[
  {
    "id": "H06",
    "apartment_type": "2-Bedroom",
    "entrance": [
      13.5,
      0.0
    ],
    "outer_polygon": [
      [
        10.0,
        0.0
      ],
      [
        10.0,
        8.0
      ],
      [
        18.0,
        8.0
      ],
      [
        18.0,
        0.0
      ],
      [
        10.0,
        0.0
      ]
    ],
    "outer_is_exterior": [
      false,
      true,
      false,
      false
    ],
    "doors": [
      [
        13.0,
        1.0
      ],
      [
        14.0,
        1.0
      ],
      [
        14.0,
        3.0
      ],
      [
        13.0,
        3.0
      ],
      [
        13.5,
        4.0
      ]
    ],
    "rooms": [
      {
        "room_type": "Hallway",
        "polygon": [
          [
            13.0,
            0.0
          ],
          [
            13.0,
            4.0
          ],
          [
            14.0,
            4.0
          ],
          [
            14.0,
            0.0
          ],
          [
            13.0,
            0.0
          ]
        ]
      },
      {
        "room_type": "Bathroom",
        "polygon": [
          [
            14.0,
            2.0
          ],
          [
            16.0,
            2.0
          ],
          [
            16.0,
            0.0
          ],
          [
            14.0,
            0.0
          ],
          [
            14.0,
            2.0
          ]
        ]
      },
      {
        "room_type": "Kitchen",
        "polygon": [
          [
            14.0,
            4.0
          ],
          [
            18.0,
            4.0
          ],
          [
            18.0,
            0.0
          ],
          [
            16.0,
            0.0
          ],
          [
            16.0,
            2.0
          ],
          [
            14.0,
            2.0
          ],
          [
            14.0,
            4.0
          ]
        ]
      },
      {
        "room_type": "Children 1",
        "polygon": [
          [
            13.0,
            0.0
          ],
          [
            10.0,
            0.0
          ],
          [
            10.0,
            2.0
          ],
          [
            13.0,
            2.0
          ],
          [
            13.0,
            0.0
          ]
        ]
      },
      {
        "room_type": "Bedroom",
        "polygon": [
          [
            13.0,
            2.0
          ],
          [
            10.0,
            2.0
          ],
          [
            10.0,
            4.0
          ],
          [
            13.0,
            4.0
          ],
          [
            13.0,
            2.0
          ]
        ]
      },
      {
        "room_type": "Living room",
        "polygon": [
          [
            10.0,
            4.0
          ],
          [
            10.0,
            8.0
          ],
          [
            18.0,
            8.0
          ],
          [
            18.0,
            4.0
          ],
          [
            10.0,
            4.0
          ]
        ]
      }
    ],
    "expected_scores": {
      "daylight": null,
      "circulation": null,
      "furnitability": null
    }
  }
]