[
  {
    "id": "H02",
    "apartment_type": "2-Bedroom",
    "entrance": [
      4.0,
      0.0
    ],
    "outer_polygon": [
      [
        0.0,
        0.0
      ],
      [
        8.0,
        0.0
      ],
      [
        8.0,
        6.0
      ],
      [
        0.0,
        6.0
      ],
      [
        0.0,
        0.0
      ]
    ],
    "outer_is_exterior": [
      true,
      false,
      false,
      false
    ],
    "doors": [
      [
        2.0,
        2.0
      ],
      [
        6.0,
        2.0
      ]
    ],
    "rooms": [
      {
        "room_type": "Hallway",
        "polygon": [
          [
            0.0,
            0.0
          ],
          [
            8.0,
            0.0
          ],
          [
            8.0,
            2.0
          ],
          [
            0.0,
            2.0
          ],
          [
            0.0,
            0.0
          ]
        ]
      },
      {
        "room_type": "Bedroom",
        "polygon": [
          [
            0.0,
            2.0
          ],
          [
            4.0,
            2.0
          ],
          [
            4.0,
            6.0
          ],
          [
            0.0,
            6.0
          ],
          [
            0.0,
            2.0
          ]
        ]
      },
      {
        "room_type": "Bedroom",
        "polygon": [
          [
            4.0,
            2.0
          ],
          [
            8.0,
            2.0
          ],
          [
            8.0,
            6.0
          ],
          [
            4.0,
            6.0
          ],
          [
            4.0,
            2.0
          ]
        ]
      }
    ],
    "expected_scores": {
      "daylight": 0.0,
      "circulation": 100.0,
      "furnitability": null
    }
  }
]